topic,problem_statement,solution,correct option
Spatial reasoning,"You have four rods of different lengths: 8 cm, 5 cm, 12 cm, and 3 cm. You must create a three-dimensional shape with all four rods so that each rod is connected to two others at its ends, forming a closed structure with triangular faces. How many distinct shapes can you form, considering that two shapes are distinct if they cannot be rotated or mirrored to look identical?",| Trace: Step 1: You have four rods of different lengths: 8 cm [Tool: symbolic] >> 1 |   Reasoning: Symbolic heuristic for 'You have four rods of different lengths: 8 cm': answer 1 | Step 2: 5 cm [Tool: llm] >> 1 |   Reasoning: Base LLM processed: 5 cm | Step 3: 12 cm [Tool: llm] >> 1 |   Reasoning: Base LLM processed: 12 cm | Step 4: and 3 cm. You must create a three-dimensional shape with all four rods so that each rod is connected to two others at its ends [Tool: symbolic] >> 1 |   Reasoning: Symbolic heuristic for 'and 3 cm. You must create a three-dimensional shape with all four rods so that each rod is connected to two others at its ends': answer 1 | Step 5: forming a closed structure with triangular faces. How many distinct shapes can you form [Tool: llm] >> 1 |   Reasoning: Base LLM processed: forming a closed structure with triangular faces. How many distinct shapes can you form | Step 6: considering that two shapes are distinct if they cannot be rotated or mirrored to look identical? [Tool: symbolic] >> 5 |   Reasoning: Symbolic heuristic for 'considering that two shapes are distinct if they cannot be rotated or mirrored to look identical?': answer 5 | Verification: None | ,1,
Lateral thinking,"A woman shoots her husband. Then she holds him underwater for five minutes. Finally, she hangs him. But 5 minutes later, they both go out and enjoy a lovely dinner together. How can this be?","| Trace: Step 1: A woman shoots her husband. Then she holds him underwater for five minutes. Finally, she hangs him. But 5 minutes later, they both go out and enjoy a lovely dinner together. How can this be? [Tool: symbolic] >> 1 |   Reasoning: Symbolic heuristic for 'A woman shoots her husband. Then she holds him underwater for five minutes. Finally, she hangs him. But 5 minutes later, they both go out and enjoy a lovely dinner together. How can this be?': answer 1 | Verification: None | ",4,
Classic riddles,You are in a race and you overtake the second person. What position are you in now?,| Trace: Step 1: You are in a race [Tool: llm] >> 1 |   Reasoning: Base LLM processed: You are in a race | Step 2: you overtake the second person. What position are you in now? [Tool: llm] >> 1 |   Reasoning: Base LLM processed: you overtake the second person. What position are you in now? | Verification: None | ,1,
Operation of mechanisms,"In a factory, there are three machines A, B, and C. Machine A polishes items, Machine B engraves them and Machine C performs a quality check. Every item must go through all three processes. The time taken by the machines is different: A takes 3 minutes per item, B takes 4 minutes per item, and C takes 2 minutes per item. Given that each machine can only handle one item at a time, in what order should the items be processed so that the maximum number of items are completed in 60 minutes?",| Trace: Step 1: In a factory [Tool: llm] >> 1 |   Reasoning: Base LLM processed: In a factory | Step 2: there are three machines A [Tool: llm] >> 1 |   Reasoning: Base LLM processed: there are three machines A | Step 3: B [Tool: llm] >> 1 |   Reasoning: Base LLM processed: B | Step 4: and C. Machine A polishes items [Tool: llm] >> 1 |   Reasoning: Base LLM processed: and C. Machine A polishes items | Step 5: Machine B engraves them and Machine C performs a quality check. Every item must go through all three processes. The time taken by the machines is different: A takes 3 minutes per item [Tool: symbolic] >> 1 |   Reasoning: Symbolic heuristic for 'Machine B engraves them and Machine C performs a quality check. Every item must go through all three processes. The time taken by the machines is different: A takes 3 minutes per item': answer 1 | Step 6: B takes 4 minutes per item [Tool: llm] >> 1 |   Reasoning: Base LLM processed: B takes 4 minutes per item | Step 7: and C takes 2 minutes per item. Given that each machine can only handle one item at a time [Tool: llm] >> 1 |   Reasoning: Base LLM processed: and C takes 2 minutes per item. Given that each machine can only handle one item at a time | Step 8: in what order should the items be processed so that the maximum number of items are completed in 60 minutes? [Tool: llm] >> 1 |   Reasoning: Base LLM processed: in what order should the items be processed so that the maximum number of items are completed in 60 minutes? | Verification: None | ,1,
Operation of mechanisms,"You have three seemingly identical machines, each with a single button on top. One of the machines is programmed to always dispense a gold coin when its button is pressed, another is programmed to always dispense a silver coin, and the third machine is programmed to randomly dispense either a gold coin or nothing. You don't have any coins to start with. Your task is to determine the mechanism of each machine by pushing their buttons as few times as possible, but there's a catch: After you push a button, there is a cooling-off period where you must wait 15 minutes before you can push any button again. What is the fewest number of times you have to press the buttons to be certain of each machine's operation?","| Trace: Step 1: You have three seemingly identical machines, each with a single button on top. One of the machines is programmed to always dispense a gold coin when its button is pressed, another is programmed to always dispense a silver coin, and the third machine is programmed to randomly dispense either a gold coin or nothing. You don't have any coins to start with. Your task is to determine the mechanism of each machine by pushing their buttons as few times as possible, but there's a catch: After you push a button, there is a cooling-off period where you must wait 15 minutes before you can push any button again. What is the fewest number of times you have to press the buttons to be certain of each machine's operation? [Tool: symbolic] >> 5 |   Reasoning: Symbolic heuristic for 'You have three seemingly identical machines, each with a single button on top. One of the machines is programmed to always dispense a gold coin when its button is pressed, another is programmed to always dispense a silver coin, and the third machine is programmed to randomly dispense either a gold coin or nothing. You don't have any coins to start with. Your task is to determine the mechanism of each machine by pushing their buttons as few times as possible, but there's a catch: After you push a button, there is a cooling-off period where you must wait 15 minutes before you can push any button again. What is the fewest number of times you have to press the buttons to be certain of each machine's operation?': answer 5 | Verification: None | ",5,
Sequence solving,"You are presented with a sequence of numbers that represent the number of dots in a series of images: 1, 5, 12, 22, 35, ? You have to figure out the principle that generates the sequence. What is the number represented by the question mark?","| Trace: Step 1: You are presented with a sequence of numbers that represent the number of dots in a series of images: 1, 5, 12, 22, 35, ? You have to figure out the principle that generates the sequence. What is the number represented by the question mark? [Tool: llm] >> 1 |   Reasoning: Base LLM processed: You are presented with a sequence of numbers that represent the number of dots in a series of images: 1, 5, 12, 22, 35, ? You have to figure out the principle that generates the sequence. What is the number represented by the question mark? | Verification: None | ",3,
Optimization of actions and planning,"Alice is planning her work schedule for the week. She has 3 tasks to complete: Task A takes 4 hours, Task B takes 3 hours, and Task C takes 2 hours. She can work a maximum of 5 hours per day. She has personal commitments on Wednesday, so she can't work more than 2 hours. What is the minimum number of days Alice needs to finish all tasks if she wants to dedicate entire work blocks to a single task and not split any task across days?",| Trace: Step 1: Alice is planning her work schedule for the week. She has 3 tasks to complete: Task A takes 4 hours [Tool: llm] >> 1 |   Reasoning: Base LLM processed: Alice is planning her work schedule for the week. She has 3 tasks to complete: Task A takes 4 hours | Step 2: Task B takes 3 hours [Tool: llm] >> 1 |   Reasoning: Base LLM processed: Task B takes 3 hours | Step 3: and Task C takes 2 hours. She can work a maximum of 5 hours per day. She has personal commitments on Wednesday [Tool: llm] >> 1 |   Reasoning: Base LLM processed: and Task C takes 2 hours. She can work a maximum of 5 hours per day. She has personal commitments on Wednesday | Step 4: so she can't work more than 2 hours. What is the minimum number of days Alice needs to finish all tasks if she wants to dedicate entire work blocks to a single task and not split any task across days? [Tool: symbolic] >> 5 |   Reasoning: Symbolic heuristic for 'so she can't work more than 2 hours. What is the minimum number of days Alice needs to finish all tasks if she wants to dedicate entire work blocks to a single task and not split any task across days?': answer 5 | Verification: None | ,1,
Spatial reasoning,"You have a 10x10x10 cube made up of 1x1x1 smaller cubes. The large cube is painted red on all of the outside surfaces. If the 10x10x10 cube is broken into the individual 1x1x1 cubes, how many of the smaller cubes will have red paint on exactly two sides?","| Trace: Step 1: You have a 10x10x10 cube made up of 1x1x1 smaller cubes. The large cube is painted red on all of the outside surfaces. If the 10x10x10 cube is broken into the individual 1x1x1 cubes, how many of the smaller cubes will have red paint on exactly two sides? [Tool: symbolic] >> 1 |   Reasoning: Symbolic heuristic for 'You have a 10x10x10 cube made up of 1x1x1 smaller cubes. The large cube is painted red on all of the outside surfaces. If the 10x10x10 cube is broken into the individual 1x1x1 cubes, how many of the smaller cubes will have red paint on exactly two sides?': answer 1 | Verification: None | ",2,
Optimization of actions and planning,"Four friends are planning to attend a series of events in a single day. They want to maximize the total number of different events they can attend. The schedule is as follows: Event A (09:00-11:00), Event B (10:30-12:30), Event C (11:15-13:15), and Event D (12:45-14:45). Assume traveling time between events is negligible and each friend can attend an event from the beginning to the end only if they don't overlap. What is the maximum number of different events the group can attend in total if they split up optimally and each event requires at least one of them to be present?",| Trace: Step 1: Four friends are planning to attend a series of events in a single day. They want to maximize the total number of different events they can attend. The schedule is as follows: Event A (09:00-11:00) [Tool: symbolic] >> 1 |   Reasoning: Symbolic heuristic for 'Four friends are planning to attend a series of events in a single day. They want to maximize the total number of different events they can attend. The schedule is as follows: Event A (09:00-11:00)': answer 1 | Step 2: Event B (10:30-12:30) [Tool: llm] >> 1 |   Reasoning: Base LLM processed: Event B (10:30-12:30) | Step 3: Event C (11:15-13:15) [Tool: llm] >> 1 |   Reasoning: Base LLM processed: Event C (11:15-13:15) | Step 4: and Event D (12:45-14:45). Assume traveling time between events is negligible and each friend can attend an event from the beginning to the end only if they don't overlap. What is the maximum number of different events the group can attend in total if they split up optimally and each event requires at least one of them to be present? [Tool: symbolic] >> 1 |   Reasoning: Symbolic heuristic for 'and Event D (12:45-14:45). Assume traveling time between events is negligible and each friend can attend an event from the beginning to the end only if they don't overlap. What is the maximum number of different events the group can attend in total if they split up optimally and each event requires at least one of them to be present?': answer 1 | Verification: None | ,1,
Classic riddles,"A wealthy book collector dies and leaves a will stating that his gold shall be shared among his three sons. According to the will, the eldest son will get half of the gold coins, the middle son will get one-third, and the youngest will get one-ninth. The book collector had 17 gold coins. To prevent them from melting down or damaging the coins to divide them, how can the sons divide the gold fairly according to the will's conditions?","| Trace: Step 1: A wealthy book collector dies and leaves a will stating that his gold shall be shared among his three sons. According to the will, the eldest son will get half of the gold coins, the middle son will get one-third, and the youngest will get one-ninth. The book collector had 17 gold coins. To prevent them from melting down or damaging the coins to divide them, how can the sons divide the gold fairly according to the will's conditions? [Tool: symbolic] >> 1 |   Reasoning: Symbolic heuristic for 'A wealthy book collector dies and leaves a will stating that his gold shall be shared among his three sons. According to the will, the eldest son will get half of the gold coins, the middle son will get one-third, and the youngest will get one-ninth. The book collector had 17 gold coins. To prevent them from melting down or damaging the coins to divide them, how can the sons divide the gold fairly according to the will's conditions?': answer 1 | Verification: None | ",1,
Sequence solving,"You're shown a sequence of numbers that appear to be increasing unpredictably: 2, 5, 10, 17, 26. You need to figure out the rule that governs the sequence to predict the next two numbers. What are the sixth and seventh numbers in this sequence?","| Trace: Step 1: You're shown a sequence of numbers that appear to be increasing unpredictably: 2, 5, 10, 17, 26. You need to figure out the rule that governs the sequence to predict the next two numbers. What are the sixth and seventh numbers in this sequence? [Tool: llm] >> 1 |   Reasoning: Base LLM processed: You're shown a sequence of numbers that appear to be increasing unpredictably: 2, 5, 10, 17, 26. You need to figure out the rule that governs the sequence to predict the next two numbers. What are the sixth and seventh numbers in this sequence? | Verification: None | ",1,
Sequence solving,"Imagine you encounter a bizarre sequence of numbers where each number depends on the one before it. The sequence begins with the number 2, and the rule to find the next number is to sum the digits of the square of the current number. The beginning of the sequence is as follows: 2, 4, 16, 7, 49, 16, 7... What is the 10th number in the sequence?","| Trace: Step 1: Imagine you encounter a bizarre sequence of numbers where each number depends on the one before it. The sequence begins with the number 2, and the rule to find the next number is to sum the digits of the square of the current number. The beginning of the sequence is as follows: 2, 4, 16, 7, 49, 16, 7... What is the 10th number in the sequence? [Tool: llm] >> 1 |   Reasoning: Base LLM processed: Imagine you encounter a bizarre sequence of numbers where each number depends on the one before it. The sequence begins with the number 2, and the rule to find the next number is to sum the digits of the square of the current number. The beginning of the sequence is as follows: 2, 4, 16, 7, 49, 16, 7... What is the 10th number in the sequence? | Verification: None | ",1,
Spatial reasoning,"In a room, there are 4 corner tables shaped as quarter-circles. Each table fits perfectly in each corner of the room. If you put them together, they form a full circle. One day, the tables were rearranged to form a new shape - a square with an empty space in the middle. The side of the square formed by the tables is twice the length of each side of the original square room. What is the ratio of the area of the empty space in the middle of the tables to the area of one table?","| Trace: Step 1: In a room, there are 4 corner tables shaped as quarter-circles. Each table fits perfectly in each corner of the room. If you put them together, they form a full circle. One day, the tables were rearranged to form a new shape - a square with an empty space in the middle. The side of the square formed by the tables is twice the length of each side of the original square room. What is the ratio of the area of the empty space in the middle of the tables to the area of one table? [Tool: symbolic] >> 1 |   Reasoning: Symbolic heuristic for 'In a room, there are 4 corner tables shaped as quarter-circles. Each table fits perfectly in each corner of the room. If you put them together, they form a full circle. One day, the tables were rearranged to form a new shape - a square with an empty space in the middle. The side of the square formed by the tables is twice the length of each side of the original square room. What is the ratio of the area of the empty space in the middle of the tables to the area of one table?': answer 1 | Verification: None | ",2,
Lateral thinking,Emma has been captured and she only has one chance to escape. The kidnapper tells her she can leave if she figures out the pattern and fills in the blank correctly. He gives her a piece of paper with the sequence: 'JFMAMJJASON_D'. What letter should Emma write in the blank to escape?,| Trace: Step 1: Emma has been captured [Tool: llm] >> 1 |   Reasoning: Base LLM processed: Emma has been captured | Step 2: she only has one chance to escape. The kidnapper tells her she can leave if she figures out the pattern [Tool: symbolic] >> 1 |   Reasoning: Symbolic heuristic for 'she only has one chance to escape. The kidnapper tells her she can leave if she figures out the pattern': answer 1 | Step 3: fills in the blank correctly. He gives her a piece of paper with the sequence: 'JFMAMJJASON_D'. What letter should Emma write in the blank to escape? [Tool: llm] >> 1 |   Reasoning: Base LLM processed: fills in the blank correctly. He gives her a piece of paper with the sequence: 'JFMAMJJASON_D'. What letter should Emma write in the blank to escape? | Verification: None | ,1,
Spatial reasoning,"Imagine a cube that is painted red on all its faces and is then cut into 27 identical smaller cubes. These smaller cubes are mixed up with identical cubes of the same size that have never been painted. If the ratio of painted to unpainted smaller cubes is 2:1, how many of the smaller cubes have exactly two red faces exposed?","| Trace: Step 1: Imagine a cube that is painted red on all its faces and is then cut into 27 identical smaller cubes. These smaller cubes are mixed up with identical cubes of the same size that have never been painted. If the ratio of painted to unpainted smaller cubes is 2:1, how many of the smaller cubes have exactly two red faces exposed? [Tool: symbolic] >> 5 |   Reasoning: Symbolic heuristic for 'Imagine a cube that is painted red on all its faces and is then cut into 27 identical smaller cubes. These smaller cubes are mixed up with identical cubes of the same size that have never been painted. If the ratio of painted to unpainted smaller cubes is 2:1, how many of the smaller cubes have exactly two red faces exposed?': answer 5 | Verification: None | ",1,
Operation of mechanisms,"A new clock has been designed to use a special mechanism where each of the three gears (A, B, and C) engage with each other in a linear sequence (A engages with B, B engages with C). Gear A rotates clockwise, and each gear has a different number of teeth: Gear A has 40 teeth, Gear B has 55 teeth, and Gear C has 70 teeth. If gear A makes one full rotation clockwise, how many rotations and in which direction will gear C complete?",| Trace: Step 1: A new clock has been designed to use a special mechanism where each of the three gears (A [Tool: llm] >> 1 |   Reasoning: Base LLM processed: A new clock has been designed to use a special mechanism where each of the three gears (A | Step 2: B [Tool: llm] >> 1 |   Reasoning: Base LLM processed: B | Step 3: and C) engage with each other in a linear sequence (A engages with B [Tool: llm] >> 1 |   Reasoning: Base LLM processed: and C) engage with each other in a linear sequence (A engages with B | Step 4: B engages with C). Gear A rotates clockwise [Tool: llm] >> 1 |   Reasoning: Base LLM processed: B engages with C). Gear A rotates clockwise | Step 5: and each gear has a different number of teeth: Gear A has 40 teeth [Tool: symbolic] >> 1 |   Reasoning: Symbolic heuristic for 'and each gear has a different number of teeth: Gear A has 40 teeth': answer 1 | Step 6: Gear B has 55 teeth [Tool: llm] >> 1 |   Reasoning: Base LLM processed: Gear B has 55 teeth | Step 7: and Gear C has 70 teeth. If gear A makes one full rotation clockwise [Tool: symbolic] >> 1 |   Reasoning: Symbolic heuristic for 'and Gear C has 70 teeth. If gear A makes one full rotation clockwise': answer 1 | Step 8: how many rotations and in which direction will gear C complete? [Tool: llm] >> 1 |   Reasoning: Base LLM processed: how many rotations and in which direction will gear C complete? | Verification: None | ,1,
Classic riddles,You arrive at a fork in the road and find a pair of identical twin sisters standing there. One sister always tells the truth and the other always lies. You can ask just one question to either sister to figure out which road leads to the city. What question should you ask?,| Trace: Step 1: You arrive at a fork in the road [Tool: llm] >> 1 |   Reasoning: Base LLM processed: You arrive at a fork in the road | Step 2: find a pair of identical twin sisters st [Tool: llm] >> 1 |   Reasoning: Base LLM processed: find a pair of identical twin sisters st | Step 3: ing there. One sister always tells the truth [Tool: symbolic] >> 1 |   Reasoning: Symbolic heuristic for 'ing there. One sister always tells the truth': answer 1 | Step 4: the other always lies. You can ask just one question to either sister to figure out which road leads to the city. What question should you ask? [Tool: symbolic] >> 1 |   Reasoning: Symbolic heuristic for 'the other always lies. You can ask just one question to either sister to figure out which road leads to the city. What question should you ask?': answer 1 | Verification: None | ,1,
Lateral thinking,"Alice, Bob, and Charlie are trapped in a room with two doors. One door leads to freedom, but the other door leads to a room full of traps that is unavoidable once someone enters. There is no indication of which door is which. In the room, there is a computer that allows them to ask one yes-or-no question. The computer will answer truthfully, but it will turn off after one question. They need to figure out which door to take without risking anyone's life. What single question can they ask the computer to ensure they pick the correct door to freedom?",| Trace: Step 1: Alice [Tool: llm] >> 1 |   Reasoning: Base LLM processed: Alice | Step 2: Bob [Tool: llm] >> 1 |   Reasoning: Base LLM processed: Bob | Step 3: and Charlie are trapped in a room with two doors. One door leads to freedom [Tool: llm] >> 1 |   Reasoning: Base LLM processed: and Charlie are trapped in a room with two doors. One door leads to freedom | Step 4: but the other door leads to a room full of traps that is unavoidable once someone enters. There is no indication of which door is which. In the room [Tool: llm] >> 1 |   Reasoning: Base LLM processed: but the other door leads to a room full of traps that is unavoidable once someone enters. There is no indication of which door is which. In the room | Step 5: there is a computer that allows them to ask one yes-or-no question. The computer will answer truthfully [Tool: symbolic] >> 5 |   Reasoning: Symbolic heuristic for 'there is a computer that allows them to ask one yes-or-no question. The computer will answer truthfully': answer 5 | Step 6: but it will turn off after one question. They need to figure out which door to take without risking anyone's life. What single question can they ask the computer to ensure they pick the correct door to freedom? [Tool: symbolic] >> 1 |   Reasoning: Symbolic heuristic for 'but it will turn off after one question. They need to figure out which door to take without risking anyone's life. What single question can they ask the computer to ensure they pick the correct door to freedom?': answer 1 | Verification: None | ,2,
