topic,problem_statement,solution,correct option
Logical traps,"Alice, Bob, and Carol are discussing two different numbers. Alice says 'The number I am thinking of is greater than 4.' Bob says 'The number I am thinking of is not the highest.' Carol says 'The number I am thinking of is not the lowest.' All three are thinking of different numbers between 1 and 6, inclusive. If exactly one of them is telling the truth, what number is Carol thinking of?",| Trace: Step 1: Alice [Tool: llm] >> 1 |   Reasoning: Base LLM processed: Alice | Step 2: Bob [Tool: llm] >> 1 |   Reasoning: Base LLM processed: Bob | Step 3: and Carol are discussing two different numbers. Alice says 'The number I am thinking of is greater than 4.' Bob says 'The number I am thinking of is not the highest.' Carol says 'The number I am thinking of is not the lowest.' All three are thinking of different numbers between 1 and 6 [Tool: symbolic] >> 5 |   Reasoning: Symbolic heuristic for 'and Carol are discussing two different numbers. Alice says 'The number I am thinking of is greater than 4.' Bob says 'The number I am thinking of is not the highest.' Carol says 'The number I am thinking of is not the lowest.' All three are thinking of different numbers between 1 and 6': answer 5 | Step 4: inclusive. If exactly one of them is telling the truth [Tool: symbolic] >> 1 |   Reasoning: Symbolic heuristic for 'inclusive. If exactly one of them is telling the truth': answer 1 | Step 5: what number is Carol thinking of? [Tool: llm] >> 1 |   Reasoning: Base LLM processed: what number is Carol thinking of? | Verification: None | ,1,
Classic riddles,"Two fathers and two sons went fishing. Each of them caught one fish, so they brought home three fishes in total. How is that possible?","| Trace: Step 1: Two fathers and two sons went fishing. Each of them caught one fish, so they brought home three fishes in total. How is that possible? [Tool: llm] >> 1 |   Reasoning: Base LLM processed: Two fathers and two sons went fishing. Each of them caught one fish, so they brought home three fishes in total. How is that possible? | Verification: None | ",1,
Optimization of actions and planning,"In an online strategy game, you're tasked with building a new base. You start with 100 resources. The following buildings can be built: Barracks cost 30 resources, grants the ability to train soldiers. Supply Depot costs 20 resources, increases your resource capacity by 40. Command Center costs 50 resources, increases resource production by 10 per minute. You also passively gain 10 resources per minute. You cannot exceed your resource capacity, which starts at 100. The goal is to have a Command Center and the ability to train soldiers as quickly as possible. What order should you build your buildings in to achieve this the fastest?","| Trace: Step 1: In an online strategy game, you're tasked with building a new base. You start with 100 resources. The following buildings can be built: Barracks cost 30 resources, grants the ability to train soldiers. Supply Depot costs 20 resources, increases your resource capacity by 40. Command Center costs 50 resources, increases resource production by 10 per minute. You also passively gain 10 resources per minute. You cannot exceed your resource capacity, which starts at 100. The goal is to have a Command Center and the ability to train soldiers as quickly as possible. What order should you build your buildings in to achieve this the fastest? [Tool: symbolic] >> 5 |   Reasoning: Symbolic heuristic for 'In an online strategy game, you're tasked with building a new base. You start with 100 resources. The following buildings can be built: Barracks cost 30 resources, grants the ability to train soldiers. Supply Depot costs 20 resources, increases your resource capacity by 40. Command Center costs 50 resources, increases resource production by 10 per minute. You also passively gain 10 resources per minute. You cannot exceed your resource capacity, which starts at 100. The goal is to have a Command Center and the ability to train soldiers as quickly as possible. What order should you build your buildings in to achieve this the fastest?': answer 5 | Verification: None | ",5,
Spatial reasoning,"You are in a room with no windows and only one door. The room is filled with mirrors on all walls. In the middle of the room stands a statue. You have a laser pointer that can bounce off the mirrors. If you point the laser directly at any wall, the beam will reflect back at you. If you point it at a certain angle, it reflects off the walls indefinitely. Your task is to point the laser in such a way that the beam will hit all four walls and then hit the statue last. How do you position the laser beam?","| Trace: Step 1: You are in a room with no windows and only one door. The room is filled with mirrors on all walls. In the middle of the room stands a statue. You have a laser pointer that can bounce off the mirrors. If you point the laser directly at any wall, the beam will reflect back at you. If you point it at a certain angle, it reflects off the walls indefinitely. Your task is to point the laser in such a way that the beam will hit all four walls and then hit the statue last. How do you position the laser beam? [Tool: symbolic] >> 5 |   Reasoning: Symbolic heuristic for 'You are in a room with no windows and only one door. The room is filled with mirrors on all walls. In the middle of the room stands a statue. You have a laser pointer that can bounce off the mirrors. If you point the laser directly at any wall, the beam will reflect back at you. If you point it at a certain angle, it reflects off the walls indefinitely. Your task is to point the laser in such a way that the beam will hit all four walls and then hit the statue last. How do you position the laser beam?': answer 5 | Verification: None | ",4,
Optimization of actions and planning,"Alice has to prepare 3 different types of cookies for an event. The chocolate chip cookies take 15 minutes to prepare and 10 minutes to bake. The sugar cookies take 10 minutes to prepare and 15 minutes to bake. The oatmeal raisin cookies take 12 minutes to prepare and 12 minutes to bake. She has only one oven, which can bake one type of cookies at a time. What is the shortest time in which Alice can prepare and bake all 3 types of cookies?",| Trace: Step 1: Alice has to prepare 3 different types of cookies for an event. The chocolate chip cookies take 15 minutes to prepare and 10 minutes to bake. The sugar cookies take 10 minutes to prepare and 15 minutes to bake. The oatmeal raisin cookies take 12 minutes to prepare and 12 minutes to bake. She has only one oven [Tool: symbolic] >> 1 |   Reasoning: Symbolic heuristic for 'Alice has to prepare 3 different types of cookies for an event. The chocolate chip cookies take 15 minutes to prepare and 10 minutes to bake. The sugar cookies take 10 minutes to prepare and 15 minutes to bake. The oatmeal raisin cookies take 12 minutes to prepare and 12 minutes to bake. She has only one oven': answer 1 | Step 2: which can bake one type of cookies at a time. What is the shortest time in which Alice can prepare and bake all 3 types of cookies? [Tool: symbolic] >> 1 |   Reasoning: Symbolic heuristic for 'which can bake one type of cookies at a time. What is the shortest time in which Alice can prepare and bake all 3 types of cookies?': answer 1 | Verification: None | ,1,
Operation of mechanisms,"Four friends are exploring an ancient temple with a complicated door mechanism. The door has four levers, and each lever can be in one of three positions: up, middle, or down. To open the door, the levers have to be in a specific configuration. They found a clue that reads: 'The first lever stands alone in its position. The second and third levers are not in the middle together. The fourth lever is in the opposite position of the second lever. One lever is up, one is in the middle, one is down, and one is lying about its position.' Which lever is lying based on its position in the clue, and what is the correct configuration to open the door?",| Trace: Step 1: Four friends are exploring an ancient temple with a complicated door mechanism. The door has four levers [Tool: llm] >> 1 |   Reasoning: Base LLM processed: Four friends are exploring an ancient temple with a complicated door mechanism. The door has four levers | Step 2: and each lever can be in one of three positions: up [Tool: llm] >> 1 |   Reasoning: Base LLM processed: and each lever can be in one of three positions: up | Step 3: middle [Tool: llm] >> 1 |   Reasoning: Base LLM processed: middle | Step 4: or down. To open the door [Tool: llm] >> 1 |   Reasoning: Base LLM processed: or down. To open the door | Step 5: the levers have to be in a specific configuration. They found a clue that reads: 'The first lever stands alone in its position. The second and third levers are not in the middle together. The fourth lever is in the opposite position of the second lever. One lever is up [Tool: symbolic] >> 5 |   Reasoning: Symbolic heuristic for 'the levers have to be in a specific configuration. They found a clue that reads: 'The first lever stands alone in its position. The second and third levers are not in the middle together. The fourth lever is in the opposite position of the second lever. One lever is up': answer 5 | Step 6: one is in the middle [Tool: llm] >> 1 |   Reasoning: Base LLM processed: one is in the middle | Step 7: one is down [Tool: llm] >> 1 |   Reasoning: Base LLM processed: one is down | Step 8: and one is lying about its position.' Which lever is lying based on its position in the clue [Tool: llm] >> 1 |   Reasoning: Base LLM processed: and one is lying about its position.' Which lever is lying based on its position in the clue | Step 9: and what is the correct configuration to open the door? [Tool: llm] >> 1 |   Reasoning: Base LLM processed: and what is the correct configuration to open the door? | Verification: None | ,1,
Sequence solving,"You are given a sequence of numbers: 2, 6, 18, 54. What would be the next number in the sequence if the pattern continues?",| Trace: Step 1: You are given a sequence of numbers: 2 [Tool: llm] >> 1 |   Reasoning: Base LLM processed: You are given a sequence of numbers: 2 | Step 2: 6 [Tool: llm] >> 1 |   Reasoning: Base LLM processed: 6 | Step 3: 18 [Tool: llm] >> 1 |   Reasoning: Base LLM processed: 18 | Step 4: 54. What would be the next number in the sequence if the pattern continues? [Tool: symbolic] >> 1 |   Reasoning: Symbolic heuristic for '54. What would be the next number in the sequence if the pattern continues?': answer 1 | Verification: None | ,2,
Spatial reasoning,"There is a cube with edges of length 4 units. It is fully painted on all sides and then divided into smaller cubes of 1 unit edge each. Without any of the cubes being removed, a single straight cut is made through the cube. What is the maximum number of smaller cubes that can have paint on exactly one side now visble as a result of this cut?","| Trace: Step 1: There is a cube with edges of length 4 units. It is fully painted on all sides and then divided into smaller cubes of 1 unit edge each. Without any of the cubes being removed, a single straight cut is made through the cube. What is the maximum number of smaller cubes that can have paint on exactly one side now visble as a result of this cut? [Tool: symbolic] >> 5 |   Reasoning: Symbolic heuristic for 'There is a cube with edges of length 4 units. It is fully painted on all sides and then divided into smaller cubes of 1 unit edge each. Without any of the cubes being removed, a single straight cut is made through the cube. What is the maximum number of smaller cubes that can have paint on exactly one side now visble as a result of this cut?': answer 5 | Verification: None | ",5,
Sequence solving,"Fill in the blank: 1, 4, 9, 16, 25, __. Find the next number in the sequence.","| Trace: Step 1: Fill in the blank: 1, 4, 9, 16, 25, __. Find the next number in the sequence. [Tool: llm] >> 1 |   Reasoning: Base LLM processed: Fill in the blank: 1, 4, 9, 16, 25, __. Find the next number in the sequence. | Verification: None | ",1,
Spatial reasoning,"You are in a room with 4 doors, each facing the cardinal directions: North, East, South, and West. Each door leads to a room that looks identical to the first, with its own 4 doors also facing the cardinal directions. You start by facing North and walk into the North door. In the second room, you face East and walk through the East door. In the third room, you face South and walk through the South door. Finally, in the fourth room, you turn to face West and walk through the West door. In which direction are you facing now in the fifth room?",| Trace: Step 1: You are in a room with 4 doors [Tool: llm] >> 1 |   Reasoning: Base LLM processed: You are in a room with 4 doors | Step 2: each facing the cardinal directions: North [Tool: llm] >> 1 |   Reasoning: Base LLM processed: each facing the cardinal directions: North | Step 3: East [Tool: llm] >> 1 |   Reasoning: Base LLM processed: East | Step 4: South [Tool: llm] >> 1 |   Reasoning: Base LLM processed: South | Step 5: and West. Each door leads to a room that looks identical to the first [Tool: llm] >> 1 |   Reasoning: Base LLM processed: and West. Each door leads to a room that looks identical to the first | Step 6: with its own 4 doors also facing the cardinal directions. You start by facing North and walk into the North door. In the second room [Tool: llm] >> 1 |   Reasoning: Base LLM processed: with its own 4 doors also facing the cardinal directions. You start by facing North and walk into the North door. In the second room | Step 7: you face East and walk through the East door. In the third room [Tool: llm] >> 1 |   Reasoning: Base LLM processed: you face East and walk through the East door. In the third room | Step 8: you face South and walk through the South door. Finally [Tool: symbolic] >> 1 |   Reasoning: Symbolic heuristic for 'you face South and walk through the South door. Finally': answer 1 | Step 9: in the fourth room [Tool: llm] >> 1 |   Reasoning: Base LLM processed: in the fourth room | Step 10: you turn to face West and walk through the West door. In which direction are you facing now in the fifth room? [Tool: symbolic] >> 5 |   Reasoning: Symbolic heuristic for 'you turn to face West and walk through the West door. In which direction are you facing now in the fifth room?': answer 5 | Verification: None | ,4,
Lateral thinking,A man is found dead in a field holding a piece of straw. There's nothing else around him except for the straw and the clothes he has on. How did he die?,| Trace: Step 1: A man is found dead in a field holding a piece of straw. There's nothing else around him except for the straw [Tool: llm] >> 1 |   Reasoning: Base LLM processed: A man is found dead in a field holding a piece of straw. There's nothing else around him except for the straw | Step 2: the clothes he has on. How did he die? [Tool: llm] >> 1 |   Reasoning: Base LLM processed: the clothes he has on. How did he die? | Verification: None | ,2,
Operation of mechanisms,"In a factory, there are three machines A, B, and C that are used to create widgets. Machine A creates a widget every 3 minutes, Machine B every 7 minutes, and Machine C every 11 minutes. If all machines are turned on at the same time, how many minutes will pass before all three machines dispense a widget at the same minute for the first time?","| Trace: Step 1: In a factory, there are three machines A, B, and C that are used to create widgets. Machine A creates a widget every 3 minutes, Machine B every 7 minutes, and Machine C every 11 minutes. If all machines are turned on at the same time, how many minutes will pass before all three machines dispense a widget at the same minute for the first time? [Tool: symbolic] >> 1 |   Reasoning: Symbolic heuristic for 'In a factory, there are three machines A, B, and C that are used to create widgets. Machine A creates a widget every 3 minutes, Machine B every 7 minutes, and Machine C every 11 minutes. If all machines are turned on at the same time, how many minutes will pass before all three machines dispense a widget at the same minute for the first time?': answer 1 | Verification: None | ",1,
Operation of mechanisms,"You are an engineer tasked with designing a gear system consisting of three gears that will fit in a sequential lineup within a machine. Each gear is required to have a unique number of teeth and must mesh with its neighboring gear(s). Gear A has 28 teeth and must connect with Gear B. Gear B must connect with both Gear A and Gear C. If the total number of teeth across all three gears shouldn't exceed 100 and the gears must have an integer number of teeth, what is the number of teeth on Gear B and Gear C?","| Trace: Step 1: You are an engineer tasked with designing a gear system consisting of three gears that will fit in a sequential lineup within a machine. Each gear is required to have a unique number of teeth and must mesh with its neighboring gear(s). Gear A has 28 teeth and must connect with Gear B. Gear B must connect with both Gear A and Gear C. If the total number of teeth across all three gears shouldn't exceed 100 and the gears must have an integer number of teeth, what is the number of teeth on Gear B and Gear C? [Tool: symbolic] >> 1 |   Reasoning: Symbolic heuristic for 'You are an engineer tasked with designing a gear system consisting of three gears that will fit in a sequential lineup within a machine. Each gear is required to have a unique number of teeth and must mesh with its neighboring gear(s). Gear A has 28 teeth and must connect with Gear B. Gear B must connect with both Gear A and Gear C. If the total number of teeth across all three gears shouldn't exceed 100 and the gears must have an integer number of teeth, what is the number of teeth on Gear B and Gear C?': answer 1 | Verification: None | ",1,
Optimization of actions and planning,"You have 12 boxes that look identical and contain identical items, but one box is filled with defective items weighing slightly less than the others. Your task is to determine which box contains the defective items. You have at your disposal a balance scale, which allows you to compare the weight of two sets of boxes against each other. You can only use the scale three times. How would you identify the box with defective items?",| Trace: Step 1: You have 12 boxes that look identical and contain identical items [Tool: llm] >> 1 |   Reasoning: Base LLM processed: You have 12 boxes that look identical and contain identical items | Step 2: but one box is filled with defective items weighing slightly less than the others. Your task is to determine which box contains the defective items. You have at your disposal a balance scale [Tool: llm] >> 1 |   Reasoning: Base LLM processed: but one box is filled with defective items weighing slightly less than the others. Your task is to determine which box contains the defective items. You have at your disposal a balance scale | Step 3: which allows you to compare the weight of two sets of boxes against each other. You can only use the scale three times. How would you identify the box with defective items? [Tool: symbolic] >> 1 |   Reasoning: Symbolic heuristic for 'which allows you to compare the weight of two sets of boxes against each other. You can only use the scale three times. How would you identify the box with defective items?': answer 1 | Verification: None | ,1,
Lateral thinking,"Alice, Bob, and Charlie are trapped on an island with a bridge that can only hold two people at a time. They have one flashlight and, because it's nighttime, the flashlight must be used when crossing the bridge. Alice can cross the bridge in 1 minute, Bob in 2 minutes, and Charlie in 5 minutes. When two people cross together, they must move at the slower person's pace. What is the shortest time in which all three can get across the bridge?","| Trace: Step 1: Alice, Bob, and Charlie are trapped on an island with a bridge that can only hold two people at a time. They have one flashlight and, because it's nighttime, the flashlight must be used when crossing the bridge. Alice can cross the bridge in 1 minute, Bob in 2 minutes, and Charlie in 5 minutes. When two people cross together, they must move at the slower person's pace. What is the shortest time in which all three can get across the bridge? [Tool: symbolic] >> 1 |   Reasoning: Symbolic heuristic for 'Alice, Bob, and Charlie are trapped on an island with a bridge that can only hold two people at a time. They have one flashlight and, because it's nighttime, the flashlight must be used when crossing the bridge. Alice can cross the bridge in 1 minute, Bob in 2 minutes, and Charlie in 5 minutes. When two people cross together, they must move at the slower person's pace. What is the shortest time in which all three can get across the bridge?': answer 1 | Verification: None | ",2,
Operation of mechanisms,"Alice, Bob, and Charlie are three engineers designing a cog-based mechanism for a clock. The mechanism includes three cogs that have to engage with each other without slipping. Cog A has 36 teeth, Cog B has 48 teeth, and Cog C has 60 teeth. If they design the mechanism for Cog A to make 10 full rotations, how many complete rotations will Cog C make in the same time, assuming there is no slippage and they rotate at a constant rate?","| Trace: Step 1: Alice, Bob, and Charlie are three engineers designing a cog-based mechanism for a clock. The mechanism includes three cogs that have to engage with each other without slipping. Cog A has 36 teeth, Cog B has 48 teeth, and Cog C has 60 teeth. If they design the mechanism for Cog A to make 10 full rotations, how many complete rotations will Cog C make in the same time, assuming there is no slippage and they rotate at a constant rate? [Tool: symbolic] >> 5 |   Reasoning: Symbolic heuristic for 'Alice, Bob, and Charlie are three engineers designing a cog-based mechanism for a clock. The mechanism includes three cogs that have to engage with each other without slipping. Cog A has 36 teeth, Cog B has 48 teeth, and Cog C has 60 teeth. If they design the mechanism for Cog A to make 10 full rotations, how many complete rotations will Cog C make in the same time, assuming there is no slippage and they rotate at a constant rate?': answer 5 | Verification: None | ",2,
Classic riddles,"I have keys but no locks. I have space but no room. You can enter, but you can't go outside. What am I?","| Trace: Step 1: I have keys but no locks. I have space but no room. You can enter, but you can't go outside. What am I? [Tool: llm] >> 1 |   Reasoning: Base LLM processed: I have keys but no locks. I have space but no room. You can enter, but you can't go outside. What am I? | Verification: None | ",1,
Optimization of actions and planning,"Alice, Bob, and Charlie are three friends who decide to paint a room together. They find that Alice can paint the room completely by herself in 5 hours, Bob can do it in 6 hours, and Charlie in 8 hours. They start painting together at the same pace they normally would by themselves, but after 2 hours, Charlie has to leave. How much time, in hours, will it take for Alice and Bob to finish painting the room after Charlie leaves?","| Trace: Step 1: Alice, Bob, and Charlie are three friends who decide to paint a room together. They find that Alice can paint the room completely by herself in 5 hours, Bob can do it in 6 hours, and Charlie in 8 hours. They start painting together at the same pace they normally would by themselves, but after 2 hours, Charlie has to leave. How much time, in hours, will it take for Alice and Bob to finish painting the room after Charlie leaves? [Tool: symbolic] >> 5 |   Reasoning: Symbolic heuristic for 'Alice, Bob, and Charlie are three friends who decide to paint a room together. They find that Alice can paint the room completely by herself in 5 hours, Bob can do it in 6 hours, and Charlie in 8 hours. They start painting together at the same pace they normally would by themselves, but after 2 hours, Charlie has to leave. How much time, in hours, will it take for Alice and Bob to finish painting the room after Charlie leaves?': answer 5 | Verification: None | ",2,
