topic,problem_statement,solution,correct option
Optimization of actions and planning,"Alice, Bob, and Charlie are planning to meet in a coffee shop that is equidistant from their homes. They can choose to take a bus, a taxi, or to walk. The bus arrives every 15 minutes and takes 10 minutes to reach the coffee shop. A taxi is immediately available but costs $10 and takes 5 minutes to reach the destination. Walking takes 30 minutes. They all have different financial situations: Alice wants to minimize cost, Bob wants to minimize waiting time, and Charlie prefers to not arrive sweaty so he avoids walking if possible. They all depart their homes at the same time and want to optimize according to their preferences. What mode of transportation should each one take?",| Trace: Step 1: Alice [Tool: llm] >> 1 |   Reasoning: Base LLM processed: Alice | Step 2: Bob [Tool: llm] >> 1 |   Reasoning: Base LLM processed: Bob | Step 3: and Charlie are planning to meet in a coffee shop that is equidistant from their homes. They can choose to take a bus [Tool: llm] >> 1 |   Reasoning: Base LLM processed: and Charlie are planning to meet in a coffee shop that is equidistant from their homes. They can choose to take a bus | Step 4: a taxi [Tool: llm] >> 1 |   Reasoning: Base LLM processed: a taxi | Step 5: or to walk. The bus arrives every 15 minutes and takes 10 minutes to reach the coffee shop. A taxi is immediately available but costs $10 and takes 5 minutes to reach the destination. Walking takes 30 minutes. They all have different financial situations: Alice wants to minimize cost [Tool: symbolic] >> 1 |   Reasoning: Symbolic heuristic for 'or to walk. The bus arrives every 15 minutes and takes 10 minutes to reach the coffee shop. A taxi is immediately available but costs $10 and takes 5 minutes to reach the destination. Walking takes 30 minutes. They all have different financial situations: Alice wants to minimize cost': answer 1 | Step 6: Bob wants to minimize waiting time [Tool: llm] >> 1 |   Reasoning: Base LLM processed: Bob wants to minimize waiting time | Step 7: and Charlie prefers to not arrive sweaty so he avoids walking if possible. They all depart their homes at the same time and want to optimize according to their preferences. What mode of transportation should each one take? [Tool: symbolic] >> 5 |   Reasoning: Symbolic heuristic for 'and Charlie prefers to not arrive sweaty so he avoids walking if possible. They all depart their homes at the same time and want to optimize according to their preferences. What mode of transportation should each one take?': answer 5 | Verification: None | ,2,
Classic riddles,A prisoner is told 'If you tell a lie we will hang you; if you tell the truth we will shoot you.' What can the prisoner say to save himself?,| Trace: Step 1: A prisoner is told 'If you tell a lie we will hang you; if you tell the truth we will shoot you.' What can the prisoner say to save himself? [Tool: symbolic] >> 1 |   Reasoning: Symbolic heuristic for 'A prisoner is told 'If you tell a lie we will hang you; if you tell the truth we will shoot you.' What can the prisoner say to save himself?': answer 1 | Verification: None | ,1,
Operation of mechanisms,"A homeowner wants to design a simple mechanical gate that opens automatically when their car approaches from the outside but does not open when the car exits the driveway. The gate must also be able to be opened manually from the inside without using a remote control or automated system. Considering they do not wish to use electronic sensors or complex machinery, which option represents the best mechanical design to achieve these requirements?","| Trace: Step 1: A homeowner wants to design a simple mechanical gate that opens automatically when their car approaches from the outside but does not open when the car exits the driveway. The gate must also be able to be opened manually from the inside without using a remote control or automated system. Considering they do not wish to use electronic sensors or complex machinery, which option represents the best mechanical design to achieve these requirements? [Tool: symbolic] >> 5 |   Reasoning: Symbolic heuristic for 'A homeowner wants to design a simple mechanical gate that opens automatically when their car approaches from the outside but does not open when the car exits the driveway. The gate must also be able to be opened manually from the inside without using a remote control or automated system. Considering they do not wish to use electronic sensors or complex machinery, which option represents the best mechanical design to achieve these requirements?': answer 5 | Verification: None | ",5,
Spatial reasoning,"You are in a magical library with four doors: one on each wall. Each door is painted with symbols. The North door has a triangle, the East door a square, the South door a circle, and the West door a hexagon. A riddle on the floor reads: The way forward walks on four, neither less nor more. To exit the library, which door do you choose?","| Trace: Step 1: You are in a magical library with four doors: one on each wall. Each door is painted with symbols. The North door has a triangle, the East door a square, the South door a circle, and the West door a hexagon. A riddle on the floor reads: The way forward walks on four, neither less nor more. To exit the library, which door do you choose? [Tool: symbolic] >> 5 |   Reasoning: Symbolic heuristic for 'You are in a magical library with four doors: one on each wall. Each door is painted with symbols. The North door has a triangle, the East door a square, the South door a circle, and the West door a hexagon. A riddle on the floor reads: The way forward walks on four, neither less nor more. To exit the library, which door do you choose?': answer 5 | Verification: None | ",5,
Sequence solving,"A sequence starts with the number 1 and each subsequent number is three times the previous number plus 1. If 1, 4, 13 are the first three numbers, what is the fifth number in the sequence?",| Trace: Step 1: A sequence starts with the number 1 and each subsequent number is three times the previous number plus 1. If 1 [Tool: symbolic] >> 1 |   Reasoning: Symbolic heuristic for 'A sequence starts with the number 1 and each subsequent number is three times the previous number plus 1. If 1': answer 1 | Step 2: 4 [Tool: llm] >> 1 |   Reasoning: Base LLM processed: 4 | Step 3: 13 are the first three numbers [Tool: llm] >> 1 |   Reasoning: Base LLM processed: 13 are the first three numbers | Step 4: what is the fifth number in the sequence? [Tool: symbolic] >> 1 |   Reasoning: Symbolic heuristic for 'what is the fifth number in the sequence?': answer 1 | Verification: None | ,1,
Lateral thinking,Pete is reading a book. Suddenly he throws the book away and turns on the light. Why did Pete throw the book away and turn on the light?,| Trace: Step 1: Pete is reading a book. Suddenly he throws the book away [Tool: llm] >> 1 |   Reasoning: Base LLM processed: Pete is reading a book. Suddenly he throws the book away | Step 2: turns on the light. Why did Pete throw the book away [Tool: llm] >> 1 |   Reasoning: Base LLM processed: turns on the light. Why did Pete throw the book away | Step 3: turn on the light? [Tool: llm] >> 1 |   Reasoning: Base LLM processed: turn on the light? | Verification: None | ,1,
Sequence solving,"Find the next number in the following sequence: 3, 4, 6, 9, 13, ... What is the next number and why?","| Trace: Step 1: Find the next number in the following sequence: 3, 4, 6, 9, 13, ... What is the next number and why? [Tool: llm] >> 1 |   Reasoning: Base LLM processed: Find the next number in the following sequence: 3, 4, 6, 9, 13, ... What is the next number and why? | Verification: None | ",1,
Spatial reasoning,"Imagine you have a cube made up of 27 smaller cubes of the same size – a 3x3x3 cube. This large cube is painted on all six outer faces. You then separate all the smaller cubes and randomly pick one. Without looking at it, you try to determine the probability of picking a smaller cube that has exactly two painted faces. What is this probability?","| Trace: Step 1: Imagine you have a cube made up of 27 smaller cubes of the same size – a 3x3x3 cube. This large cube is painted on all six outer faces. You then separate all the smaller cubes and randomly pick one. Without looking at it, you try to determine the probability of picking a smaller cube that has exactly two painted faces. What is this probability? [Tool: symbolic] >> 1 |   Reasoning: Symbolic heuristic for 'Imagine you have a cube made up of 27 smaller cubes of the same size – a 3x3x3 cube. This large cube is painted on all six outer faces. You then separate all the smaller cubes and randomly pick one. Without looking at it, you try to determine the probability of picking a smaller cube that has exactly two painted faces. What is this probability?': answer 1 | Verification: None | ",2,
Lateral thinking,"A man is found hanging dead from the ceiling in a flooded room. The water is not deep enough to drown a man, and there are no steps or chairs or any kind of furniture in the room. He didn’t die by drowning, but by hanging. How is this possible?","| Trace: Step 1: A man is found hanging dead from the ceiling in a flooded room. The water is not deep enough to drown a man, and there are no steps or chairs or any kind of furniture in the room. He didn’t die by drowning, but by hanging. How is this possible? [Tool: llm] >> 1 |   Reasoning: Base LLM processed: A man is found hanging dead from the ceiling in a flooded room. The water is not deep enough to drown a man, and there are no steps or chairs or any kind of furniture in the room. He didn’t die by drowning, but by hanging. How is this possible? | Verification: None | ",2,
Spatial reasoning,"Imagine a 3x3x3 Rubik's cube. Each small cube on the surface is colored either red, blue, or green. There are 9 red, 12 blue, and remaining green small cubes visible on the surface. Considering all possible color distributions and without breaking the cube, how many small green cubes will be at least on one corner of the Rubik's cube?","| Trace: Step 1: Imagine a 3x3x3 Rubik's cube. Each small cube on the surface is colored either red, blue, or green. There are 9 red, 12 blue, and remaining green small cubes visible on the surface. Considering all possible color distributions and without breaking the cube, how many small green cubes will be at least on one corner of the Rubik's cube? [Tool: symbolic] >> 1 |   Reasoning: Symbolic heuristic for 'Imagine a 3x3x3 Rubik's cube. Each small cube on the surface is colored either red, blue, or green. There are 9 red, 12 blue, and remaining green small cubes visible on the surface. Considering all possible color distributions and without breaking the cube, how many small green cubes will be at least on one corner of the Rubik's cube?': answer 1 | Verification: None | ",1,
Operation of mechanisms,"In a factory, there are three machines A, B, and C. Machine A can complete an order in 4 hours, Machine B can complete the same order in 6 hours, and Machine C can complete it in 12 hours. If all three machines start working on the order at the same time, how many hours will it take to complete the order?","| Trace: Step 1: In a factory, there are three machines A, B, and C. Machine A can complete an order in 4 hours, Machine B can complete the same order in 6 hours, and Machine C can complete it in 12 hours. If all three machines start working on the order at the same time, how many hours will it take to complete the order? [Tool: symbolic] >> 1 |   Reasoning: Symbolic heuristic for 'In a factory, there are three machines A, B, and C. Machine A can complete an order in 4 hours, Machine B can complete the same order in 6 hours, and Machine C can complete it in 12 hours. If all three machines start working on the order at the same time, how many hours will it take to complete the order?': answer 1 | Verification: None | ",1,
Optimization of actions and planning,"Claire has 4 tasks to complete with varying levels of urgency and duration. Task A must be done before Task C and takes 3 hours. Task B is not urgent but takes 4 hours. Task C is very urgent and takes 2 hours. Task D is moderately urgent and takes 1 hour. Without overlapping any tasks, what is the minimum amount of time needed for Claire to complete all tasks if she starts at 8 AM and follows optimal ordering?",| Trace: Step 1: Claire has 4 tasks to complete with varying levels of urgency and duration. Task A must be done before Task C and takes 3 hours. Task B is not urgent but takes 4 hours. Task C is very urgent and takes 2 hours. Task D is moderately urgent and takes 1 hour. Without overlapping any tasks [Tool: llm] >> 1 |   Reasoning: Base LLM processed: Claire has 4 tasks to complete with varying levels of urgency and duration. Task A must be done before Task C and takes 3 hours. Task B is not urgent but takes 4 hours. Task C is very urgent and takes 2 hours. Task D is moderately urgent and takes 1 hour. Without overlapping any tasks | Step 2: what is the minimum amount of time needed for Claire to complete all tasks if she starts at 8 AM and follows optimal ordering? [Tool: symbolic] >> 1 |   Reasoning: Symbolic heuristic for 'what is the minimum amount of time needed for Claire to complete all tasks if she starts at 8 AM and follows optimal ordering?': answer 1 | Verification: None | ,1,
Lateral thinking,"A woman buys a new pair of shoes, goes to work, and dies. What happened?","| Trace: Step 1: A woman buys a new pair of shoes, goes to work, and dies. What happened? [Tool: llm] >> 1 |   Reasoning: Base LLM processed: A woman buys a new pair of shoes, goes to work, and dies. What happened? | Verification: None | ",1,
Optimization of actions and planning,"Alex, Brenda, and Chloe want to paint a series of three houses, each in a different color: red, green, or blue. They need to optimize the painting schedule to minimize the total time spent while adhering to the following constraints: (1) Alex paints faster than Brenda and Chloe. (2) Brenda cannot paint a house green. (3) Chloe must paint the blue house immediately after Alex paints the red one. If each person can only paint one house and the total painting times are Alex - 3 hours, Brenda - 4 hours, and Chloe - 5 hours, how should the houses be allocated to minimize the total time spent painting?",| Trace: Step 1: Alex [Tool: llm] >> 1 |   Reasoning: Base LLM processed: Alex | Step 2: Brenda [Tool: llm] >> 1 |   Reasoning: Base LLM processed: Brenda | Step 3: and Chloe want to paint a series of three houses [Tool: llm] >> 1 |   Reasoning: Base LLM processed: and Chloe want to paint a series of three houses | Step 4: each in a different color: red [Tool: symbolic] >> 1 |   Reasoning: Symbolic heuristic for 'each in a different color: red': answer 1 | Step 5: green [Tool: llm] >> 1 |   Reasoning: Base LLM processed: green | Step 6: or blue. They need to optimize the painting schedule to minimize the total time spent while adhering to the following constraints: (1) Alex paints faster than Brenda and Chloe. (2) Brenda cannot paint a house green. (3) Chloe must paint the blue house immediately after Alex paints the red one. If each person can only paint one house and the total painting times are Alex - 3 hours [Tool: symbolic] >> 5 |   Reasoning: Symbolic heuristic for 'or blue. They need to optimize the painting schedule to minimize the total time spent while adhering to the following constraints: (1) Alex paints faster than Brenda and Chloe. (2) Brenda cannot paint a house green. (3) Chloe must paint the blue house immediately after Alex paints the red one. If each person can only paint one house and the total painting times are Alex - 3 hours': answer 5 | Step 7: Brenda - 4 hours [Tool: llm] >> 1 |   Reasoning: Base LLM processed: Brenda - 4 hours | Step 8: and Chloe - 5 hours [Tool: llm] >> 1 |   Reasoning: Base LLM processed: and Chloe - 5 hours | Step 9: how should the houses be allocated to minimize the total time spent painting? [Tool: symbolic] >> 1 |   Reasoning: Symbolic heuristic for 'how should the houses be allocated to minimize the total time spent painting?': answer 1 | Verification: None | ,1,
Optimization of actions and planning,"You have an electric car that can travel up to 100 miles on a full charge. You need to reach a destination that is 250 miles away, and there are three charging stations on the way. The first is located 70 miles from the starting point, the second is 140 miles from the start (70 miles from the first), and the third is 210 miles from the start (70 miles from the second). Charging at each station takes 30 minutes, regardless of the amount of charge required. Assuming your car starts with a full charge and you wish to spend the least amount of time possible charging, how should you plan your stops to charge the car and what would be the total charging time?","| Trace: Step 1: You have an electric car that can travel up to 100 miles on a full charge. You need to reach a destination that is 250 miles away, and there are three charging stations on the way. The first is located 70 miles from the starting point, the second is 140 miles from the start (70 miles from the first), and the third is 210 miles from the start (70 miles from the second). Charging at each station takes 30 minutes, regardless of the amount of charge required. Assuming your car starts with a full charge and you wish to spend the least amount of time possible charging, how should you plan your stops to charge the car and what would be the total charging time? [Tool: llm] >> 1 |   Reasoning: Base LLM processed: You have an electric car that can travel up to 100 miles on a full charge. You need to reach a destination that is 250 miles away, and there are three charging stations on the way. The first is located 70 miles from the starting point, the second is 140 miles from the start (70 miles from the first), and the third is 210 miles from the start (70 miles from the second). Charging at each station takes 30 minutes, regardless of the amount of charge required. Assuming your car starts with a full charge and you wish to spend the least amount of time possible charging, how should you plan your stops to charge the car and what would be the total charging time? | Verification: None | ",1,
Spatial reasoning,"You are in a room with four doors, each leading to a path that goes in one of the four cardinal directions: North, East, South, and West. Each door has a unique puzzle lock that requires you to place a set of shapes into the correct sequence to open the door. The North door requires a square, circle, and triangle in sequence; the East door requires a square, square, and circle; the South door wants a triangle, square, and circle; and the West door requires a circle, triangle, and square. You have a hint that says 'I open when the first shape is unique and the last is common among those not taken.' Which door should you choose?","| Trace: Step 1: You are in a room with four doors, each leading to a path that goes in one of the four cardinal directions: North, East, South, and West. Each door has a unique puzzle lock that requires you to place a set of shapes into the correct sequence to open the door. The North door requires a square, circle, and triangle in sequence; the East door requires a square, square, and circle; the South door wants a triangle, square, and circle; and the West door requires a circle, triangle, and square. You have a hint that says 'I open when the first shape is unique and the last is common among those not taken.' Which door should you choose? [Tool: llm] >> 1 |   Reasoning: Base LLM processed: You are in a room with four doors, each leading to a path that goes in one of the four cardinal directions: North, East, South, and West. Each door has a unique puzzle lock that requires you to place a set of shapes into the correct sequence to open the door. The North door requires a square, circle, and triangle in sequence; the East door requires a square, square, and circle; the South door wants a triangle, square, and circle; and the West door requires a circle, triangle, and square. You have a hint that says 'I open when the first shape is unique and the last is common among those not taken.' Which door should you choose? | Verification: None | ",4,
Operation of mechanisms,"In a room, there are three machines. Each machine has two modes: blue mode and red mode. Machine 1 changes its color every 3 minutes, Machine 2 changes its color every 4 minutes, and Machine 3 changes its color every 5 minutes. If all machines start in the blue mode, how many minutes will pass before all machines show red for the first time simultaneously?","| Trace: Step 1: In a room, there are three machines. Each machine has two modes: blue mode and red mode. Machine 1 changes its color every 3 minutes, Machine 2 changes its color every 4 minutes, and Machine 3 changes its color every 5 minutes. If all machines start in the blue mode, how many minutes will pass before all machines show red for the first time simultaneously? [Tool: symbolic] >> 1 |   Reasoning: Symbolic heuristic for 'In a room, there are three machines. Each machine has two modes: blue mode and red mode. Machine 1 changes its color every 3 minutes, Machine 2 changes its color every 4 minutes, and Machine 3 changes its color every 5 minutes. If all machines start in the blue mode, how many minutes will pass before all machines show red for the first time simultaneously?': answer 1 | Verification: None | ",2,
Spatial reasoning,"Imagine a cube that has a number from 1 to 6 on each face, much like a die. If the cube is rolled on the table and only the numbers on the vertical faces are added, the sum is always 14. The cube is now thrown and lands with the number 3 facing up. What is the number on the bottom face?","| Trace: Step 1: Imagine a cube that has a number from 1 to 6 on each face, much like a die. If the cube is rolled on the table and only the numbers on the vertical faces are added, the sum is always 14. The cube is now thrown and lands with the number 3 facing up. What is the number on the bottom face? [Tool: symbolic] >> 5 |   Reasoning: Symbolic heuristic for 'Imagine a cube that has a number from 1 to 6 on each face, much like a die. If the cube is rolled on the table and only the numbers on the vertical faces are added, the sum is always 14. The cube is now thrown and lands with the number 3 facing up. What is the number on the bottom face?': answer 5 | Verification: None | ",5,
Sequence solving,"You come across three sequences which follow a specific pattern. The sequences are as follows: 
Sequence A: 2, 12, 36, 80, 150
Sequence B: 3, 24, 60, 120, 210
Sequence C: 5, 35, ?, 175, 275
Find the missing number in Sequence C.",| Trace: Step 1: You come across three sequences which follow a specific pattern. The sequences are as follows:  | Sequence A: 2 [Tool: symbolic] >> 1 |   Reasoning: Symbolic heuristic for 'You come across three sequences which follow a specific pattern. The sequences are as follows:  | Sequence A: 2': answer 1 | Step 2: 12 [Tool: llm] >> 1 |   Reasoning: Base LLM processed: 12 | Step 3: 36 [Tool: llm] >> 1 |   Reasoning: Base LLM processed: 36 | Step 4: 80 [Tool: llm] >> 1 |   Reasoning: Base LLM processed: 80 | Step 5: 150 | Sequence B: 3 [Tool: llm] >> 1 |   Reasoning: Base LLM processed: 150 | Sequence B: 3 | Step 6: 24 [Tool: llm] >> 1 |   Reasoning: Base LLM processed: 24 | Step 7: 60 [Tool: llm] >> 1 |   Reasoning: Base LLM processed: 60 | Step 8: 120 [Tool: llm] >> 1 |   Reasoning: Base LLM processed: 120 | Step 9: 210 | Sequence C: 5 [Tool: llm] >> 1 |   Reasoning: Base LLM processed: 210 | Sequence C: 5 | Step 10: 35 [Tool: llm] >> 1 |   Reasoning: Base LLM processed: 35 | Step 11: ? [Tool: llm] >> 1 |   Reasoning: Base LLM processed: ? | Step 12: 175 [Tool: llm] >> 1 |   Reasoning: Base LLM processed: 175 | Step 13: 275 | Find the missing number in Sequence C. [Tool: llm] >> 1 |   Reasoning: Base LLM processed: 275 | Find the missing number in Sequence C. | Verification: None | ,1,
