topic,problem_statement,solution,correct option
Spatial reasoning,"Four friends are at corners of a large square field and want to reach the exact center of the field at the same time. Each of them starts walking at the same time with the same walking speed but each takes a different straight path. The paths are as follows: Friend A walks directly towards the center, Friend B walks diagonally to the opposite corner and then takes a 90-degree turn towards the center, Friend C walks to the midpoint of one of the edges of the square and then walks parallel to another edge to reach the center, and Friend D takes a path that first heads to the center of an adjacent edge and then directly towards the center. Assuming they all walk at a constant speed, which friend would need to walk the fastest to reach the center at the same time as the others?",| Trace: Step 1: Four friends are at corners of a large square field and want to reach the exact center of the field at the same time. Each of them starts walking at the same time with the same walking speed but each takes a different straight path. The paths are as follows: Friend A walks directly towards the center [Tool: symbolic] >> 1 |   Reasoning: Symbolic heuristic for 'Four friends are at corners of a large square field and want to reach the exact center of the field at the same time. Each of them starts walking at the same time with the same walking speed but each takes a different straight path. The paths are as follows: Friend A walks directly towards the center': answer 1 | Step 2: Friend B walks diagonally to the opposite corner and then takes a 90-degree turn towards the center [Tool: symbolic] >> 1 |   Reasoning: Symbolic heuristic for 'Friend B walks diagonally to the opposite corner and then takes a 90-degree turn towards the center': answer 1 | Step 3: Friend C walks to the midpoint of one of the edges of the square and then walks parallel to another edge to reach the center [Tool: symbolic] >> 5 |   Reasoning: Symbolic heuristic for 'Friend C walks to the midpoint of one of the edges of the square and then walks parallel to another edge to reach the center': answer 5 | Step 4: and Friend D takes a path that first heads to the center of an adjacent edge and then directly towards the center. Assuming they all walk at a constant speed [Tool: symbolic] >> 1 |   Reasoning: Symbolic heuristic for 'and Friend D takes a path that first heads to the center of an adjacent edge and then directly towards the center. Assuming they all walk at a constant speed': answer 1 | Step 5: which friend would need to walk the fastest to reach the center at the same time as the others? [Tool: llm] >> 1 |   Reasoning: Base LLM processed: which friend would need to walk the fastest to reach the center at the same time as the others? | Verification: None | ,1,
Spatial reasoning,An ant is located at one corner of a 10 x 10 x 10 cube. It needs to crawl to the diagonally opposite corner in the shortest possible path without crossing any of the cube's faces. What is the minimum surface distance the ant must travel?,| Trace: Step 1: An ant is located at one corner of a 10 x 10 x 10 cube. It needs to crawl to the diagonally opposite corner in the shortest possible path without crossing any of the cube's faces. What is the minimum surface distance the ant must travel? [Tool: symbolic] >> 1 |   Reasoning: Symbolic heuristic for 'An ant is located at one corner of a 10 x 10 x 10 cube. It needs to crawl to the diagonally opposite corner in the shortest possible path without crossing any of the cube's faces. What is the minimum surface distance the ant must travel?': answer 1 | Verification: None | ,1,
Spatial reasoning,"A builder has a set of 5 differently shaped blocks: a cube, a sphere, a pyramid, a cylinder, and a cone. He places all of them in a row but notices that when viewed from the top, three particular shapes align perfectly such that their top surfaces form a straight line. Which three shapes are these and in what order do they appear in the row? Note that the cylinder's height is twice its diameter, the cone's height is equal to the diameter of its base, and the cube side length is equal to the diameter of the sphere.",| Trace: Step 1: A builder has a set of 5 differently shaped blocks: a cube [Tool: symbolic] >> 1 |   Reasoning: Symbolic heuristic for 'A builder has a set of 5 differently shaped blocks: a cube': answer 1 | Step 2: a sphere [Tool: llm] >> 1 |   Reasoning: Base LLM processed: a sphere | Step 3: a pyramid [Tool: llm] >> 1 |   Reasoning: Base LLM processed: a pyramid | Step 4: a cylinder [Tool: llm] >> 1 |   Reasoning: Base LLM processed: a cylinder | Step 5: and a cone. He places all of them in a row but notices that when viewed from the top [Tool: symbolic] >> 5 |   Reasoning: Symbolic heuristic for 'and a cone. He places all of them in a row but notices that when viewed from the top': answer 5 | Step 6: three particular shapes align perfectly such that their top surfaces form a straight line. Which three shapes are these and in what order do they appear in the row? Note that the cylinder's height is twice its diameter [Tool: llm] >> 1 |   Reasoning: Base LLM processed: three particular shapes align perfectly such that their top surfaces form a straight line. Which three shapes are these and in what order do they appear in the row? Note that the cylinder's height is twice its diameter | Step 7: the cone's height is equal to the diameter of its base [Tool: llm] >> 1 |   Reasoning: Base LLM processed: the cone's height is equal to the diameter of its base | Step 8: and the cube side length is equal to the diameter of the sphere. [Tool: llm] >> 1 |   Reasoning: Base LLM processed: and the cube side length is equal to the diameter of the sphere. | Verification: None | ,1,
Spatial reasoning,"You have a 4x4x4 cube made up of 64 smaller 1x1x1 cubes. You paint the entire outer surface of the large cube. After it dries, you take apart the cube and notice that some of the smaller cubes have 0, 1, 2, or 3 painted faces. How many of the smaller cubes have exactly 2 painted faces?","| Trace: Step 1: You have a 4x4x4 cube made up of 64 smaller 1x1x1 cubes. You paint the entire outer surface of the large cube. After it dries, you take apart the cube and notice that some of the smaller cubes have 0, 1, 2, or 3 painted faces. How many of the smaller cubes have exactly 2 painted faces? [Tool: symbolic] >> 5 |   Reasoning: Symbolic heuristic for 'You have a 4x4x4 cube made up of 64 smaller 1x1x1 cubes. You paint the entire outer surface of the large cube. After it dries, you take apart the cube and notice that some of the smaller cubes have 0, 1, 2, or 3 painted faces. How many of the smaller cubes have exactly 2 painted faces?': answer 5 | Verification: None | ",5,
Operation of mechanisms,"In a factory, there are three machines A, B, and C that are programmed to finish a task in exactly 1, 2, and 3 hours respectively. However, each machine needs a 30-minute setup time initially which doesn't count towards the task completion time. If all machines are started at the same time, how long will it take for all three machines to finish the task?","| Trace: Step 1: In a factory, there are three machines A, B, and C that are programmed to finish a task in exactly 1, 2, and 3 hours respectively. However, each machine needs a 30-minute setup time initially which doesn't count towards the task completion time. If all machines are started at the same time, how long will it take for all three machines to finish the task? [Tool: symbolic] >> 1 |   Reasoning: Symbolic heuristic for 'In a factory, there are three machines A, B, and C that are programmed to finish a task in exactly 1, 2, and 3 hours respectively. However, each machine needs a 30-minute setup time initially which doesn't count towards the task completion time. If all machines are started at the same time, how long will it take for all three machines to finish the task?': answer 1 | Verification: None | ",1,
Sequence solving,"In a unique sequence, each number is the sum of the 3 previous numbers. The sequence starts with 2, 2, and 4. What is the 6th number in the sequence?","| Trace: Step 1: In a unique sequence, each number is the sum of the 3 previous numbers. The sequence starts with 2, 2, and 4. What is the 6th number in the sequence? [Tool: llm] >> 1 |   Reasoning: Base LLM processed: In a unique sequence, each number is the sum of the 3 previous numbers. The sequence starts with 2, 2, and 4. What is the 6th number in the sequence? | Verification: None | ",1,
Spatial reasoning,"In a cube-cutting challenge, you have a solid cube made of wood. In each move, you can make a straight cut through the cube. After the first cut, you now have two pieces. You make a second cut through both pieces, and now have four pieces. You make a third cut through all four pieces, and have some number of pieces now. Without rearranging any pieces between cuts, what is the maximum number of pieces you could have after the third cut?","| Trace: Step 1: In a cube-cutting challenge, you have a solid cube made of wood. In each move, you can make a straight cut through the cube. After the first cut, you now have two pieces. You make a second cut through both pieces, and now have four pieces. You make a third cut through all four pieces, and have some number of pieces now. Without rearranging any pieces between cuts, what is the maximum number of pieces you could have after the third cut? [Tool: symbolic] >> 5 |   Reasoning: Symbolic heuristic for 'In a cube-cutting challenge, you have a solid cube made of wood. In each move, you can make a straight cut through the cube. After the first cut, you now have two pieces. You make a second cut through both pieces, and now have four pieces. You make a third cut through all four pieces, and have some number of pieces now. Without rearranging any pieces between cuts, what is the maximum number of pieces you could have after the third cut?': answer 5 | Verification: None | ",5,
Logical traps,"In a special logic class, the teacher announces a surprise test will happen during the next week (Monday to Friday). However, the teacher also gives a hint: the test cannot be on Friday, since if it weren't given by Thursday, students would know for sure it was on Friday, and thus it would not be a surprise. After some thought, one clever student argues that following this logic, the test can't be on Thursday either, because come Wednesday night, without a test, Thursday would be the only remaining option, ceasing to be a surprise. Continuing this deduction, she concludes the test can't be on Wednesday... Tuesday... or even Monday! However, to the students' shock, the test was indeed given during the next week and it still was a surprise. How could this be, and when was the test given?",| Trace: Step 1: In a special logic class [Tool: llm] >> 1 |   Reasoning: Base LLM processed: In a special logic class | Step 2: the teacher announces a surprise test will happen during the next week (Monday to Friday). However [Tool: llm] >> 1 |   Reasoning: Base LLM processed: the teacher announces a surprise test will happen during the next week (Monday to Friday). However | Step 3: the teacher also gives a hint: the test cannot be on Friday [Tool: symbolic] >> 5 |   Reasoning: Symbolic heuristic for 'the teacher also gives a hint: the test cannot be on Friday': answer 5 | Step 4: since if it weren't given by Thursday [Tool: symbolic] >> 1 |   Reasoning: Symbolic heuristic for 'since if it weren't given by Thursday': answer 1 | Step 5: students would know for sure it was on Friday [Tool: llm] >> 1 |   Reasoning: Base LLM processed: students would know for sure it was on Friday | Step 6: and thus it would not be a surprise. After some thought [Tool: llm] >> 1 |   Reasoning: Base LLM processed: and thus it would not be a surprise. After some thought | Step 7: one clever student argues that following this logic [Tool: llm] >> 1 |   Reasoning: Base LLM processed: one clever student argues that following this logic | Step 8: the test can't be on Thursday either [Tool: llm] >> 1 |   Reasoning: Base LLM processed: the test can't be on Thursday either | Step 9: because come Wednesday night [Tool: llm] >> 1 |   Reasoning: Base LLM processed: because come Wednesday night | Step 10: without a test [Tool: llm] >> 1 |   Reasoning: Base LLM processed: without a test | Step 11: Thursday would be the only remaining option [Tool: llm] >> 1 |   Reasoning: Base LLM processed: Thursday would be the only remaining option | Step 12: ceasing to be a surprise. Continuing this deduction [Tool: llm] >> 1 |   Reasoning: Base LLM processed: ceasing to be a surprise. Continuing this deduction | Step 13: she concludes the test can't be on Wednesday... Tuesday... or even Monday! However [Tool: llm] >> 1 |   Reasoning: Base LLM processed: she concludes the test can't be on Wednesday... Tuesday... or even Monday! However | Step 14: to the students' shock [Tool: llm] >> 1 |   Reasoning: Base LLM processed: to the students' shock | Step 15: the test was indeed given during the next week and it still was a surprise. How could this be [Tool: llm] >> 1 |   Reasoning: Base LLM processed: the test was indeed given during the next week and it still was a surprise. How could this be | Step 16: and when was the test given? [Tool: llm] >> 1 |   Reasoning: Base LLM processed: and when was the test given? | Verification: None | ,1,
Spatial reasoning,"Imagine you have a solid wooden cube that measures 3 units on each side. This cube is painted blue on all sides. After the paint dries, you slice this cube into 1-unit cubes. How many of the smaller 1-unit cubes will have exactly two sides painted blue?","| Trace: Step 1: Imagine you have a solid wooden cube that measures 3 units on each side. This cube is painted blue on all sides. After the paint dries, you slice this cube into 1-unit cubes. How many of the smaller 1-unit cubes will have exactly two sides painted blue? [Tool: symbolic] >> 1 |   Reasoning: Symbolic heuristic for 'Imagine you have a solid wooden cube that measures 3 units on each side. This cube is painted blue on all sides. After the paint dries, you slice this cube into 1-unit cubes. How many of the smaller 1-unit cubes will have exactly two sides painted blue?': answer 1 | Verification: None | ",1,
Optimization of actions and planning,"You are planning a small party and you have three types of beverages to choose from: juice, soda, and water. Based on your guests' preferences, you know the following: - 60% prefer juice, 20% prefer soda, and 20% prefer water. - You have a budget that allows you to buy a total of 100 drinks. - One unit of juice costs $1, soda costs $0.80, and water costs $0.50. - You want to satisfy the preferences of at least 90% of your guests. How many units of each beverage should you buy to meet the preferences and stay within the budget, assuming each guest will have one drink?","| Trace: Step 1: You are planning a small party and you have three types of beverages to choose from: juice, soda, and water. Based on your guests' preferences, you know the following: - 60% prefer juice, 20% prefer soda, and 20% prefer water. - You have a budget that allows you to buy a total of 100 drinks. - One unit of juice costs $1, soda costs $0.80, and water costs $0.50. - You want to satisfy the preferences of at least 90% of your guests. How many units of each beverage should you buy to meet the preferences and stay within the budget, assuming each guest will have one drink? [Tool: symbolic] >> 5 |   Reasoning: Symbolic heuristic for 'You are planning a small party and you have three types of beverages to choose from: juice, soda, and water. Based on your guests' preferences, you know the following: - 60% prefer juice, 20% prefer soda, and 20% prefer water. - You have a budget that allows you to buy a total of 100 drinks. - One unit of juice costs $1, soda costs $0.80, and water costs $0.50. - You want to satisfy the preferences of at least 90% of your guests. How many units of each beverage should you buy to meet the preferences and stay within the budget, assuming each guest will have one drink?': answer 5 | Verification: None | ",5,
Spatial reasoning,"A cube has edges of length 2 cm. If the largest possible cylinder is carved out of this cube, what will be the total surface area of the remaining part of the cube?","| Trace: Step 1: A cube has edges of length 2 cm. If the largest possible cylinder is carved out of this cube, what will be the total surface area of the remaining part of the cube? [Tool: symbolic] >> 2 |   Reasoning: Symbolic heuristic for 'A cube has edges of length 2 cm. If the largest possible cylinder is carved out of this cube, what will be the total surface area of the remaining part of the cube?': answer 2 | Verification: None | ",2,
Sequence solving,"Consider the sequence where each number indicates the position that the digit 2 appears for the first time in that number (for example, '10' is in position 1 because it contains the digit 2 for the first time as the sequence starts). What is the 5th number in this sequence?","| Trace: Step 1: Consider the sequence where each number indicates the position that the digit 2 appears for the first time in that number (for example, '10' is in position 1 because it contains the digit 2 for the first time as the sequence starts). What is the 5th number in this sequence? [Tool: llm] >> 1 |   Reasoning: Base LLM processed: Consider the sequence where each number indicates the position that the digit 2 appears for the first time in that number (for example, '10' is in position 1 because it contains the digit 2 for the first time as the sequence starts). What is the 5th number in this sequence? | Verification: None | ",1,
Spatial reasoning,"A sculptor is creating a unique set of sculptures by stacking cubes of the same size. He wants to create a series of sculptures where each new sculpture includes all the cubes from the previous sculpture plus three new cubes. The first sculpture is a single cube. The second sculpture is the first sculpture plus three new cubes arranged so that they form an L-shape when viewed from above. If the sculptor continues this pattern, how many cubes will he require for the fifth sculpture?",| Trace: Step 1: A sculptor is creating a unique set of sculptures by stacking cubes of the same size. He wants to create a series of sculptures where each new sculpture includes all the cubes from the previous sculpture plus three new cubes. The first sculpture is a single cube. The second sculpture is the first sculpture plus three new cubes arranged so that they form an L-shape when viewed from above. If the sculptor continues this pattern [Tool: symbolic] >> 1 |   Reasoning: Symbolic heuristic for 'A sculptor is creating a unique set of sculptures by stacking cubes of the same size. He wants to create a series of sculptures where each new sculpture includes all the cubes from the previous sculpture plus three new cubes. The first sculpture is a single cube. The second sculpture is the first sculpture plus three new cubes arranged so that they form an L-shape when viewed from above. If the sculptor continues this pattern': answer 1 | Step 2: how many cubes will he require for the fifth sculpture? [Tool: symbolic] >> 1 |   Reasoning: Symbolic heuristic for 'how many cubes will he require for the fifth sculpture?': answer 1 | Verification: None | ,1,
Spatial reasoning,"Imagine a cube that is formed by 27 smaller identical cubes, making it a 3x3x3 cube. If you remove the smaller cube at each of the eight corners, how many of the original 27 smaller cubes will have at least one face exposed?","| Trace: Step 1: Imagine a cube that is formed by 27 smaller identical cubes, making it a 3x3x3 cube. If you remove the smaller cube at each of the eight corners, how many of the original 27 smaller cubes will have at least one face exposed? [Tool: symbolic] >> 1 |   Reasoning: Symbolic heuristic for 'Imagine a cube that is formed by 27 smaller identical cubes, making it a 3x3x3 cube. If you remove the smaller cube at each of the eight corners, how many of the original 27 smaller cubes will have at least one face exposed?': answer 1 | Verification: None | ",1,
Sequence solving,"You are presented with a sequence of numbers: 3, 4, 6, 9, 13, ... What is the next number in the sequence?","| Trace: Step 1: You are presented with a sequence of numbers: 3, 4, 6, 9, 13, ... What is the next number in the sequence? [Tool: llm] >> 1 |   Reasoning: Base LLM processed: You are presented with a sequence of numbers: 3, 4, 6, 9, 13, ... What is the next number in the sequence? | Verification: None | ",3,
Optimization of actions and planning,"You are the operations manager at a factory producing widgets. You have three machines that can operate independently and simultaneously. Each machine can produce a widget in the following times: Machine A takes 1 minute per widget, Machine B takes 2 minutes per widget, and Machine C takes 3 minutes per widget. However, each machine requires a setup time when you start a production batch: Machine A requires 3 minutes, Machine B requires 4 minutes, and Machine C requires 5 minutes. Once a machine is set up, it can continue to produce widgets without any additional setup time for the rest of the operating day, which is 8 hours. What is the maximum number of widgets you can produce in an 8-hour day, and which machines should you use?","| Trace: Step 1: You are the operations manager at a factory producing widgets. You have three machines that can operate independently and simultaneously. Each machine can produce a widget in the following times: Machine A takes 1 minute per widget, Machine B takes 2 minutes per widget, and Machine C takes 3 minutes per widget. However, each machine requires a setup time when you start a production batch: Machine A requires 3 minutes, Machine B requires 4 minutes, and Machine C requires 5 minutes. Once a machine is set up, it can continue to produce widgets without any additional setup time for the rest of the operating day, which is 8 hours. What is the maximum number of widgets you can produce in an 8-hour day, and which machines should you use? [Tool: llm] >> 1 |   Reasoning: Base LLM processed: You are the operations manager at a factory producing widgets. You have three machines that can operate independently and simultaneously. Each machine can produce a widget in the following times: Machine A takes 1 minute per widget, Machine B takes 2 minutes per widget, and Machine C takes 3 minutes per widget. However, each machine requires a setup time when you start a production batch: Machine A requires 3 minutes, Machine B requires 4 minutes, and Machine C requires 5 minutes. Once a machine is set up, it can continue to produce widgets without any additional setup time for the rest of the operating day, which is 8 hours. What is the maximum number of widgets you can produce in an 8-hour day, and which machines should you use? | Verification: None | ",5,
Spatial reasoning,"In a mystical land, there are three temples, each on top of a hill. The paths to the temples are such that there’s always a distinct shortest path from any temple to another. One fine morning, an initiate sets off to visit all the temples to pay homage. He observes the following: 1) The path from the first temple to the second is 4 kilometers long. 2) The path from the second temple to the third is 3 kilometers long. 3) The uphill path from the first to the third temple is 5 kilometers long. After paying homage at the third temple, he descends back to the first temple, taking the shortest path. How long is his entire journey?","| Trace: Step 1: In a mystical land, there are three temples, each on top of a hill. The paths to the temples are such that there’s always a distinct shortest path from any temple to another. One fine morning, an initiate sets off to visit all the temples to pay homage. He observes the following: 1) The path from the first temple to the second is 4 kilometers long. 2) The path from the second temple to the third is 3 kilometers long. 3) The uphill path from the first to the third temple is 5 kilometers long. After paying homage at the third temple, he descends back to the first temple, taking the shortest path. How long is his entire journey? [Tool: symbolic] >> 5 |   Reasoning: Symbolic heuristic for 'In a mystical land, there are three temples, each on top of a hill. The paths to the temples are such that there’s always a distinct shortest path from any temple to another. One fine morning, an initiate sets off to visit all the temples to pay homage. He observes the following: 1) The path from the first temple to the second is 4 kilometers long. 2) The path from the second temple to the third is 3 kilometers long. 3) The uphill path from the first to the third temple is 5 kilometers long. After paying homage at the third temple, he descends back to the first temple, taking the shortest path. How long is his entire journey?': answer 5 | Verification: None | ",5,
